{
  "schema_version": 1,
  "run_id": "regenerative-impact-map-chatgpt-v1-r6--001",
  "plan_id": "regenerative-impact-map-chatgpt-v1-r6",
  "skill_id": "regenerative-impact-map",
  "result": "pass",
  "executed_at": "2026-09-29T15:25:00-03:00",
  "product_surface": "chatgpt-skills",
  "package_version": "0.6.0",
  "distribution": "local",
  "source_revision": "80669fc10b6e963dd1f17fec52c00186fd40ba8e",
  "artifact_sha256": "ddc80278253af21534ef1a62dc3f760034b1bf8036cd2886883485892be865f1",
  "case_ids": [
    "explicit-impact-map-r6"
  ],
  "assertions": [
    {
      "case_id": "explicit-impact-map-r6",
      "pass": true,
      "observed": "Explicit invocation produced the plain-language brief plus decision, boundary, affected/missing voices, all five lenses, reinforcing loop, balancing safeguard, resource baseline/budget, chosen intervention, regenerative seed, and review owner/date/stop/restoration fields, with reversible-next-step reasoning."
    }
  ],
  "evaluation_note": null,
  "metrics": {
    "measurement_state": "not-collected",
    "input_tokens": null,
    "output_tokens": null,
    "elapsed_ms": null,
    "cost_usd": null,
    "tool_calls": null
  },
  "provenance": {
    "source_file": "trust/in-product-runs.json",
    "source_schema_version": 1
  }
}
